"id","nombre_iniciativa","componente_innovador","descripcion_iniciativa"
"174","ORPHEUS","Plataforma web que permite a los funcionarios de salud agendar citas en línea, registro de historia clínica, facturación, recordatorio de citas y agenda del día vía E-MAIL, entre otros, para optimizar procesos.","2ORPHEUS es la plataforma médica diseñada exclusivamente para consultorios particulares y clínicas de atención ambulatoria de cualquier especialidad. Completa, segura y flexible. Podrás controlar al detalle la evolución de tus pacientes, controlar tus finanzas y agendar tus consultas. Además tus pacientes podrán sacar citas en línea. Todo a través de un sistema claro y sencillo."
"220","Observatorio RECID","El Observatorio consta de una estructura de alto impacto de tres partes: estudios, incidencia e informes de observancia. En la parte de estudios, realiza investigaciones independientes mediante nuevas tecnologías y datos abiertos. La parte de incidencia, y de observancia se orienta en políticas de cooperación internacional y desarrollo.","El Observatorio busca dar respuesta a la necesidad de contar con información sistematizada y accesible en materia de Cooperación Internacional para el Desarrollo (CID), la cual sea útil y pertinente para tomadores de decisiones, sociedad civil, académicos y público interesado."
"123","Observatorio de Cambio Rural (OCARU)","Plataforma web donde se lleva un registro sobre los cambios socioeconómicos y políticos en el campo que abre debate entre organizaciones sociales e instituciones sociales para mejorar la posición de las organizaciones indígenas, campesinas y de mujeres rurales","OCARU es una plataforma de debate sobre la transformaciones en el campo por la Soberanía Alimentaria y las sociedades rurales donde se lleva un registro sobre los cambios socioeconómicos y políticos"
"39","Oficina de Innovación y Sostenibilidad - USFQ","Desarrolla y promociona estrategias sustentables que permiten el crecimiento y desarrollo de la USFQ en armonía con la sociedad, el medio ambiente y la economía","La Oficina de Innovación y Sostenibilidad se encarga de impulsar el trabajo conjunto entre la academia, las empresas públicas y privadas, y la comunidad interna y externa en cuanto a crear valor compartido en temas de innovación y sostenibilidad refiere. La Oficina de Innovación y Sostenibilidad sostiene diversos programas y proyectos que van desde cursos sobre sostenibilidad hasta proyectos de investigación y desarrollo en estrategias sustentables, tales como energías alternativas, entre otros"
"182","Open Knowledge Foundation","Fomenta la conversación de datos abiertos y conocimiento para promover el desarrollo de iniciativas y proyectos en el país, por medio de un sitio web que actúa como vículo para compartir noticias, proyectos y actividades que puedan ser replicadas y apoyadas en el país","Open Knowledge Foundation Ecuador (OKF Ecuador), iniciativa que busca fomentar la conversación respecto a los datos abiertos y el conocimiento abierto, y además promover el desarrollo de iniciativas y proyectos relacionados a estos temas en el país"
"205","PACHA","En principal enfoque es el mejoramiento genético de alpacas, transformación y comercialización de sus productos derivados; cuidado del páramo comunal y las vertientes de agua; así como la promoción de la agroecología en las zonas bajas para evitar la presión sobre los recursos naturales de zonas frágiles como el páramo.","El proyecto PACHA contempla a familias indígenas y comunidades alpaqueras de 4 provincias (Imbabura, Cotopaxi, Chimborazo y Cañar) que viven en los ecosistemas de páramo y altiplano de Ecuador, para que incrementen su capital económico, social y ambiental dentro de un contexto de cambio climático para el año 2024."
"2","PLANTA LA DATA","Cuando se administran bien, los recursos naturales renovables, las cuencas hidrográficas y los paisajes terrestres y marinos productivos pueden ser la base del crecimiento sostenido e inclusivo, la seguridad alimentaria y la reducción de la pobreza.","Los ecosistemas saludables son esenciales para el crecimiento a largo plazo de sectores económicos como la agricultura, la silvicultura, la pesca y el turismo. Proveen cientos de millones de empleos. Un tercio de las 100 ciudades más grandes del mundo se abastece de agua a partir de áreas protegidas. Es por ellos la importancia de los datos en el medio ambiente."
"201","PROCOSTA","Heifer promueve el acceso a medios de producción y fortalecimiento de cadenas productivas vinculadas a los recursos marino costeros, para que familias cuenten con ingresos sostenibles. Para esto, respalda sus esfuerzos de restauración y manejo comunitario del ecosistema manglar, respetando sus conocimientos y características culturales.","El programa PROCOSTA quiere contribuir a la sostenibilidad ambiental y económica de casi 200.000 familias para el 2024, así como de sus comunidades y territorios de ecosistemas de manglares costeros en ocho países latinoamericanos."
"203","PROMESA","Mejoramiento económico y seguridad alimentaria con café y cacao, contribuyendo a mejorar la calidad de vida y la sostenibilidad de los productores cacaoteros y también reducir su dependencia de un solo producto estacional, generándoles ingresos todo el año.","El programa PROMESA ejecuta una serie de acciones que permiten favorecer la seguridad alimentaria de los pequeños productores de café y cacao de la provincia de Manabí (Ecuador)."
"229","Paquete de servicios pro-empresarial","Impulso de círculos empresariales, programas de formación continua con base en las necesidades de los empresarios jóvenes y de asesorías en las áreas: financiera, comercio exterior, comunicación, jurídica, laboral, talento humano y tributaria.","Promover espacios que generen oportunidades de negocios para el empresariado joven del país."
"315","ParqueSoft UPEC","ParqueSoft UPEC es un ecossistema de emprendimento entorno al arte digital, la ciencia y las tecnologias de la información. Promueve acompañamiento y conocimientos para apoyar, fortalecer y potenciar las ideas de negocio de los emprendedores y de las empresas, buscando solucionar las principales problemáticas de la provincia y el país.","El proyecto busca gestionar acciones a favor de los emprendedores de la província de Carchi, contribuyendo en el desarrollo de un nuevo sector de la economia del conocimiento para Ecuador, aplicando valores de la cultura emprendedora, bajo el principio de emprendimiento continuo para la potenciación de empresas."
"351","Paso Doble","PROYECTO EN CONSTRUCCIÓN. 
Uso de plataforma tecnológica que tiene por objetivo enlazar servicios de atención en ámbitos preventivos, dirigidos al envejecimiento activo y saludable; a través de programas dirigidos por adultos mayores para adultos mayores.","PROYECTO EN CONSTRUCCIÓN. Provisión de servicios de atención al adulto mayor enfocados en la prevención del deterioro físico y cognitivo, a través de programas virtuales que serán impartidos por una plataforma. Se prevé emplear a dultos mayores con el objetivo de romper las brechas intergeneracionales."
"343","Plan Vida","El Plan Vida para Riobamba ha plantado más de mil árboles en la ciudad durante este año. Con el objetivo de mejorar la calidad de vida de los ciudadanos. La meta es llegar a los 15 mil árboles para diciembre de 2021.","El Plan de vida para Riobamba es parte del proyecto macro de arborización urbana de las veredas de todos los barrios de la ciudad, buscando sembrar vida y salud para el cantón."
"356","Plan de Reforestación","La Alcaldía de Tulcán está reforestando con plantas nativas el Área Protegida Municipal, además de estar sembrando en áreas privadas y en comunidades, para que los ciudadanos sean corresponsables del cuidado con el planeta.","Los árboles son destinados a conformación de cercas vivas y cortinas rompe vientos, reforestando varios espacios. Hay previsión de que sean sembradas más de diez mil plantas."
"246","Plan de reactivación productiva, soberanía alimentaria y nutrición","Promueve un plan de desarrollo integral del agro, ganadería y pesca fundamentado en: el desarrollo tecnológico, la trazabilidad de la producción, la producción orgánica y la profesionalización de los actores de la cadena de valor. Trabaja de activamente en las agendas de transformación productiva territorial de los gobiernos locales y sus actores.","El programa se orienta al desarrollo de proyectos de alto impacto en el sector del agro en Ecuador en particular y en Latinoamérica en general. Estos toman como punto de partida una perspectiva holística sobre las necesidades y las soluciones que se deben implementar en este sector."
"62","Plataforma Coworking","Por medio de espacios de trabajo, charlas y talleres ayudan a los emprendedores a potencializar sus proyectos","Somos una smartoffice y te ofrecemos: Soluciones inteligentes y sostenibles para tu empresa Diseño que inspira productividad y profesionalismo que ayudan a los emprendedores y trabajadores"
"354","Plataforma de Coordinación Interagencial para Refugiados y Migrantes (R4V)","La plataforma está integrada por más de 200 ONGs nacionales e internacionales apoyadas por instituciones internacionales de financiamiento y más de 30 donantes del sector privado e institucional, sirviendo como herramienta de planificación e incidencia.","El proyecto busca complementar la respuesta de las autoridades nacionales, garantizar transparencia y retroalimentación a las personas refugiadas y migrantes y a sus comunidades de acogida y visibilizar las actividades y necesidades financieras de socios de la plataforma para poder seguir asistiendo de manera eficaz y coordinada las necesidades de los refugiados y migrantes de Venezuela."
"314","Plataforma digital de Edu-Comunicación para “Educar y Prevenir las Enfermedades del Cerebro y el Corazón”.","Plataforma digital de Edu-comunicación para la formación en hábitos de vida saludable y prevención de enfermedades cerebrocardiovasculares","La plataforma digital, es un espacio innovador, donde se busca crear y desarrollar un medio de Edu-Comunicación para “Educar y Prevenir las Enfermedades del Cerebro y el Corazón”, a través de la divulgación de artículos, vídeos, consejos sobre alimentación, ejercicio y hábitos de vida saludable. Pretende también ser un canal de comunicación en doble vía para responder inquietudes del público."
"30","Profuturo","A través de una solución educativa digital e integral que combina métodos de enseñanza y de aprendizaje, modulares y adaptados a cada entorno y contexto. ProFuturo centra sus esfuerzos en lograr que los docentes tengan una buena formación y las mejores herramientas para proporcionar una educación de calidad a niños de zonas vulnerables","ProFuturo es un programa de educación digital impulsado por Fundación Telefónica y Fundación “la Caixa” que tiene como misión reducir la brecha educativa en el mundo proporcionando una educación digital de calidad a niños y niñas de entornos vulnerables de Latinoamérica, el Caribe, África y Asia. Su visión es mejorar la educación de millones de niños y niñas en todo el mundo, llegando a ser un referente mundial de la transformación e innovación educativas."
"206","Programa AMCHAM Triple Impacto","El programa tiene como objetivo motivar un cambio de paradigma en la manera de hacer negocios y gestionar una organización, que impulse un propósito con la intención de generar impactos positivos en lo económico, social y el medio ambiente; diseñando un programa que permite a todas las organizaciones transitar a la transparencia y triple impacto.","Es una iniciativa de la Cámara de Comercio Ecuatoriano Americana – AmCham Quito, en alianza con Sistema B y con el apoyo de distintos aliados, que durante el 2020 y 2021 busca consolidar una comunidad regional de empresas que apuestan por un entorno social y ambiental sano y de bienestar, al mismo tiempo que mejoran su desempeño económico."
"238","Programa Asociatividad y Emprendimiento para Jóvenes de los Movimientos Indígenas de Tungurahua","Los participantes de este proyecto recibirán 60 horas de capacitación divididas en cuatro módulos relacionadas con el desarrollo humano, asociatividad, ideación de negocios y gestión estratégica para crear y fortalecer sus emprendimientos.","En su segunda edición, el programa busca desarrollar emprendimientos socio económicos y productivos que aporten y generen fuentes de ingreso y trabajo en los sectores rurales y campesinos de la provincia de Tungurahua."
"178","Programa Coaching – Volcán Cotopaxi","Analizar innovaciones para aplicar antes, durante y después de una posible erupción del volcán Cotopaxi.","El LINQ y el GovLab han diseñado el Programa de Coaching para analizar innovaciones para aplicar previo, durante y después de una posible erupción del volcán Cotopaxi. Para identificar dichas innovaciones se trabajará en conjunto con expertos en mitigación de riesgos de desastres naturales a nivel mundial. Al finalizar el programa se habrá identificado las innovaciones más factibles y el LINQ coordinará con las entidades pertinentes y buscará los medios para que las soluciones más urgentes sean implementadas."
"190","Programa Emprendecdores","Brinda acompañamiento mediante la conformación de una red local de emprendimiento, la co-creación de identidades locales de los barrios y la activación de los barrios mediante actividades de emprendimiento y culturales. Este programa aporta al desarrollo urbano sostenible de los barrios y a la creación de ecosistemas locales de emprendimiento.","Es un programa orientado a fortalecer las capacidades de pequeños y medianos emprendedores y emprendedoras de barrios periféricos y rurales en varias locaciones alrededor del Ecuador."
"320","Programa KUYTSA-Power","El programa KUYTSA-Power busca el empoderamiento de adolescentes, hombres y mujeres jóvenes indígenas a través la educación y el uso de las nuevas tecnologías. Teniendo como misión ayudar a los adolescentes y jóvenes indígenas a alcanzar sus metas profesionales y de negocios proveyéndoles de capacitaciones y mentorías.","La iniciativa busca fortalecer la participación inclusiva de la juventud indígena en la gobernabilidad y la democracia, impulsar el empoderamiento económico de las mujeres, hombres jóvenes indígenas y desarrollar la capacidad de las mujeres y hombres para distinguir opciones, tomar decisiones para así lograr una igualdad de género."
"125","Programa Recuperación Cobertura Vegetal","Con técnicas específicas restauran áreas afectadas o en proceso de degradación natural para proteger áreas de interés hídrico","Desde el 2005 el PRCV realiza esfuerzos para implementar las mejores estrategias de restauración en áreas afectadas o en proceso de degradación natural, a través de técnicas acordes con las condiciones ecológicas del medio, cuenta con dos grandes líneas de acción, que engloban un sin número de actividades, donde la participación activa y constante de los actores públicos y privados y de los beneficiarios locales de comunidades aseguran el éxito y la permanencia a largo plazo de los beneficios hídricos de las intervenciones"
"319","Programa WARMI-Preneur","El proyecto combina empoderamiento, capacitación y tecnología para ayudar a las mujeres indígenas a desarrollar habilidades empresariales. Se les proporciona orientación financiera y de uso de la tecnología, conocimientos sobre como aprovechar las oportunidades de mercado con la mejor estrategia de marca que se adapte a su identidad cultural.","El modelo de empoderamiento económico WARMI-Preneur busca el avance económico de las mujeres y el desarrollo de su poder y agencia para lograr beneficios financieros, así como para crear valor social para su comunidad. El proyecto combina empoderamiento, gestión, capacitación y tecnología para ayudar a las mujeres indígenas a desarrollar habilidades empresariales."
"287","Programa completo de desarrollo de software full-stack","Maneja una metodología de aprender haciendo (aprendizaje basado en proyectos) y aprendizaje entre pares, para fomentar una cultura de aprendizaje constructiva, resiliente e innovadora. Además, el plan de estudios intensivo está diseñado en torno al aprendizaje colaborativo, basado en desarrollar habilidades para la resolución de problemas reales.","Es un programa de formación completa. Los primeros tres módulos cubren los fundamentos de programación, incluyendo programación low-level y algoritmos, programación high-level y bases de datos, y el desarrollo de sistemas y redes.
Luego, ofrecen la posibilidad de especialización en una tecnología emergente: Machine Learning, Realidad Aumentada y Realidad Virtual, Low-level y Algoritmos o Desarrollo Web Full-stack.
A lo largo del programa,se incluye la enseñanza de habilidades blandas, incorporando la preparación para entrevistas, hablar en público, trabajar en equipo y más."
"191","Programa de Cambio Climático - PCC","Las soluciones concretas, eficientes y accesibles frente al cambio climático se enfocan en los diferentes grupos poblacionales, especialmente aquellos más vulnerables por su condición socioeconómica; y tienen como eje la ciencia y la tecnología.","Tiene como objetivo fomentar la investigación de las causas y efectos que tiene la variación del clima sobre los componentes físicos, bióticos y socioeconómicos del territorio; así como la implementación de medidas de adaptación y mitigación que permitan a los gobiernos y a la sociedad ser actores activos en la lucha contra el calentamiento global."
"192","Programa de Conservación de la Biodiversidad y Recursos Naturales - PCBRN","El programa abarca un conjunto de actividades y proyectos de investigación, educación, generación de soluciones a nivel local y regional, manejo in situ, monitoreo ecológico y planes de manejo. Se complementa con el  iniciativas que posibilitan el involucramiento de la sociedad civil en problemáticas socio-ambientales tanto urbanas como rurales.","Tiene como objetivo principal involucrar a expertos, instituciones y actores sociales en la ejecución de acciones en favor de los seres vivos y los recursos naturales que son parte fundamental de la ecología terrestre y de un desarrollo sostenible global."
"193","Programa de Energía Renovable y Eficiencia Energética - PEREE","El programa busca generar eficiencia energética a través de la optimización de procesos en el sector industrial y doméstico.","La iniciativa tiene como principal objetivo promover la investigación e implementación de formas alternativas al uso tradicional de combustibles fósiles, tanto en el ámbito empresarial/industrial como en el doméstico."
"267","Programa de Fromación Profesional en Administración de Empresas de Economía Popular y Solidaria Modalidad e-learning","Mejorar las capacidades administrativas de quienes están involucrados en procesos de producción y comercialización asociativa por medio de herramientas digitales y procesos formativos impulsados por la cooperación internacional.","Promover la gestión de un modelo de empresas de Economía Popular y Solidaria fortaleciendo sus procesos socio- organizativo, de producción y comercialización asociativa logrando su sostenibilidad social, económica, ambiental y mejorando las condiciones de vida de sus socios y productores."
"292","Programa de Gestión en Desarrollo Social","La iniciativa se basa en ciclos de conferencias sobre innovación social, emprendimiento y liderazgo tiene un enfoque humanista, orientado al ámbito de la intervención social. Busca proporcionar una visión práctica a través de la experimentación y las herramientas que contribuyen a un mayor ejercicio del liderazgo.","Inspirar a las personas a tomar acción y ejecutar proyectos de impacto social en sus comunidades, además de brindar un espacio que propicie el intercambio de experiencias y la participación activa de los participantes en la esfera pública."
"337","Programa de becas UNACEM Ecuador","La empresa ofrece becas de 150 dólares para los niños de primaria, 300 dólares para de secundaria y 600 dólares para universidad, que busca colaborar en la parte logística como transporte y alimentación. Los beneficiarios deben conseguir un alto rendimiento académico para conservar esta beca que son monitoreadas por autoridades de la comunidad.","El ""Programa de becas UNACEM Ecuador"", contribuye que los niños y jóvenes de las comunidades; indígenas y mujeres en su mayoría, terminen los ciclos de enseñanza primaria y secundaria e incluso acceder a la universidad. El programa de becas se circunscribe a convenios de cooperación con los cabildos de las comunidades de su zona."
"140","Programa socios","Por medio de un acompañamiento personalizado se asesora a la empresa en todo el ciclo de ventas para que estos aumenten sus ingresos y beneficios.","Al convertirse en aliado de TopManage recibe apoyo personalizado en ventas, mercadeo y entrenamiento. Aumente sus ventas, complete sus canales de ventas y disminuya los tiempos de cierre. Nuestro equipo compuesto por un gerente de ventas, representantes de pre y post venta, e ingenieros de sistemas siempre estarán disponibles para brindarle asistencia."
"366","Promoción de Ecoturismo Comunitario en el Recinto Mashpi","En el proyecto se trabajó en cuatro componentes: 1) Se legalizó la organización en la Superintendencia de Economía Popular y Solidaria; 2) Capacitaciones vinculadas al área turística; 3) Se creó la página web www.riomashpi.org, el logo de la organización y material promocional; 4) Construcción de un área de acampada para recibir turistas.","El objetivo principal de la iniciativa era mejorar la calidad de vida de los y las pobladores de Mashpi a través del desarrollo del turismo sostenible de naturaleza."
"219","Prosperidad viral","Con el uso de la ciencia de datos, las plataformas tecnológicas y la capacitación para el desarrollo de capacidades, este proyecto busca potenciar el espíritu empresarial al brindar las herramientas y el conocimiento para hacer que los pequeños negocios sean sostenibles y minimizar los riesgos de fallas.","Prosperidad Viral es un proyecto que propone una solución integral para empoderar a los pequeños y microempresarios que forman parte de los cuatro deciles más bajos de la población."
"270","Proyecto Ecuador - Venezuela creando oportunidades de prosperidad","Dentro de este colectivo analizado se identificarán perfiles con una capacidad de emprender para apoyarlos en su inserción en el mercado.","Se analizará el perfil de personalidad de 800 venezolanos, radicados legalmente en Quito, Guayaquil y Manta, determinando cuáles son sus fortalezas y su línea base, así como un análisis de sus comunidades de acogida."
"272","Proyecto Export - DES","Cuenta con un componente asociativo, a través del cual, mediante herramientas de empaque, calidad, promoción y comunicación; apoyó a 10 iniciativas asociativas, que, a su vez, apoyan a más de 1800 pequeños productores de cacao, café, turismo comunitario, camarones, frutas orgánicas, chips de plátano, madera.","Cofinanciado por la Unión Europea y ejecutado por CORPEI, con la colaboración del Ministerio de Producción, Comercio Exterior, Inversiones y Pesca, el proyecto Export-DES benefició a 138 MIPYMES y 3323 productores ecuatorianos que buscan ampliar sus mercados y llevar lo mejor de Ecuador a la UE y a todo el mundo."
"196","Proyecto Fondo de Inversión","Todos los emprendimientos ganadores presentarán sus productos en las ediciones de Feria de Loja, Feria de Navidad, Feria del Jean, Ruedas de Negocio y Tiendas Feria de Loja; además recibirán acompañamiento y formación continua por parte de la CFL; siendo un trabajo de co-construcción con la ciudadanía","El objetivo del proyecto es apoyar a la generación de empleo formal en el sur del Ecuador con énfasis en el sector rural, a través del desarrollo de emprendimientos que requieran reactivación y crecimiento en etapa PostCovid, mediante la capacitación, acompañamiento, acceso a mercados y financiamiento con capital semilla."
"273","Proyecto Huella de Carbono Organizacional - Empresas altamente competitivas","Su propósito es apoyar a la reactivación económica del Ecuador y, al mismo tiempo, fortalecer la competitividad de las empresas. La medición de huella de carbono dota de herramientas ambientales como instrumento para la reducción de gases de efecto invernadero con impacto en el cambio climático, que generan un valor agregado a la empresa.","Es una iniciativa cofinanciada, que ofrece asesoría técnica integral para que empresas calculen su huella de carbono y plantear estrategias para mitigarla. El proyecto es el legado de otros cuatro proyectos, liderados por CORPEI junto con organismos nacionales e internacionales, que fortalecieron la competitividad y procesos de los principales productos de exportación del Ecuador."
