"id","nombre_iniciativa","componente_innovador","descripcion_iniciativa"
"171","Fundación Sin Barreras","Uso de herramientas pedagógicas para crear iniciativas desde un grupo marginado.","FUNSIBA, es una organización no gubernamental privada sin fines de lucro con finalidad social, creada con el afán de dar servicio a personas con Discapacidad Intelectual Severa a través de aprendizajes en el desenvolvimiento social, familiar y personal, con una clara visión de integración. Aprobada mediante Acuerdo Ministerial 6503 otorgado por el Ministerio de Inclusión Económica y Social de la República del Ecuador el 4 de noviembre del 2003."
"5","GAD CARCHI GOBIERNO ELECTRÓNICO","Brindar al Gobierno Autónomo Descentralizado de la Provincia del Carchi una adecuada plataforma tecnológica, que apoye de manera robusta y eficaz a los procesos administrativos y productivos que se desarrollan en cada una de las unidades de la Corporación Provincial, para el cumplimiento de las metas y objetivos institucionales.","Esta es una adecuada plataforma tecnológica, que apoye de manera robusta y eficaz a los procesos administrativos y productivos que se desarrollan en cada una de las unidades de la Corporación Provincial, para el cumplimiento de las metas y objetivos institucionales."
"6","GAD DE POTOVIEJO VOLUNTARIADO INNOVADOR","Se ha trabajado intensamente para fortalecer el rol del voluntariado para la gestión de riesgos a través de un proyecto que busca establecer áreas prioritarias para la capacitación de voluntarios y apoyar al Gobierno Autónomo Municipal (GAD) de Portoviejo en la gestión de voluntarios.","Esta iniciativa nació a partir del terremoto de magnitud 7,8 que afectó a la provincia de Manabí, especialmente al cantón de Portoviejo. En este contexto y luego de una primera visita efectuada por VNU a Portoviejo en mayo de 2016, se identificó la necesidad de fortalecer el rol del voluntariado en el marco de respuesta a situaciones de emergencia. En agosto del mismo año, VNU realizó una segunda visita con el acompañamiento del experto regional de VNU en Gestión de Riesgos y junto con el equipo técnico del GAD de Portoviejo se validó la versión final del proyecto."
"204","GANASOL","Heifer fomenta la ganadería y agricultura sustentable para producir más y como resultado las familias gocen de una buena alimentación; fomentamos procesos de transformación y adición de valor agregado a la producción agropecuaria; y fortalecemos espacios de comercialización.","Trabajamos con los pequeños productores, comunidades y familias campesinas en la región andina del Ecuador. Este proyecto se implementa en 5 provincias (Cotopaxi, Loja, Chimborazo, Pichincha e Imbabura). Estas provincias se consideran microcentros de agrobiodiversidad por la amplia variedad de especies y variedades que se cultivan en las parcelas campesinas."
"233","Gestión de Presencia y Productividad del Talento Humano","Plataforma en la nube, permite la descentralización de funciones y la reducción de más del 80% de la carga operativa de los departamentos de Recursos Humanos en las empresas.","Es una solución en la nube, aplicada a la gestión de la presencia, productividad, tiempos y movilidad del personal de una empresa. Facilita el ahorro en los procesos de control de asistencia y pago de horas extra, así como el impulso de analítica de datos basada en modelos."
"113","Go Plataforma","Colaboración enfocada a esfuerzos conjuntos.","Experiencias y  espacios diseñados en torno a las necesidades de las personas y las empresas, con un enfoque en colaboración, productividad y crecimiento.  
para que tenga un mejor desarrollo."
"344","Guaranda, ciudad latinoamericana por el Comercio Justo","Se buscará la realización de acciones concretas y de impacto, como declarar el compromiso por el Comercio Justo y la Economía Popular Social y Solidaria, promover las compras públicas responsables a pequeños productores del país, fomentando la asociatividad entre otras actividades.","Reconociendo la importancia del Comercio Justo, como modelo económico, para el desarrollo social y económico de la ciudad de Guaranda, el alcalde firmó la declaración para dar comienzo a la campaña local ""Guaranda Ciudad Latinoamericana por el Comercio Justo"". El Sistema de Comercio Justo pone como prioridad a los seres humanos y la sostenibilidad social, económica y ambiental de la sociedad, dignificando el trabajo, respetando el medio ambiente y fomentando una gestión responsable y sostenible de los recursos naturales."
"144","Guayaquil es tu destino","Aplicación que permite georeferenciar lugares turísticos de Guayaquil, eventos y gastronomía para fomentar el turismo tanto de extranjeros como de ecuatorianos","""Conozca todos los actractivos turísticos que ofrece el Puerto Principal del Ecuador.
 """"Guayaquil es mi Destino"""" es la marca turística de la ciudad, que los convoca a todos, ecuatorianos y extranjeros, a visitarnos. Guayaquil es la ciudad del Río y del Estero, pulso vital del desarrollo económico del país, única en su historia y su geografía. Es cuna de libertad, tradición, cultura, naturaleza y gastronomía. Los esperamos con alegría y entusiasmo, ¡será un honor tenerlos aquí!"""
"326","Guayungas Hub Invernadero Cultural","El Invernadero Cultural Guayungas Hub, es una plataforma -laboratorio digital de creación, circulación y capacitación en las artes emergentes ecuatorianas que conecta contenidos, visibilizando múltiples materialidades en las artes visuales y sonoras en Ecuador y sus nuevas narrativas, donde se aprovecha al internet como un espacio público que consolida un puente conectando nodos de redes entre los comunes. 
A través de estas nuevas narrativas que se conjugan entre sí, se potencian los diálogos con la actualidad, futuro sostenible, salud, el medio ambiente, género y tecnologías exponenciales aplicadas a las artes contemporáneas.","Plataforma digital de creación, circulación y capacitación en las artes contemporáneas, impulsada por el Colectivo Central Dogma, que surge como reconocimiento y apoyo al trabajo de lxs creadorxs emergentes ecuatorianxs, a partir de la necesidad de considerar a las artes y a la cultura como herramientas generadoras de estrategias para garantizar la salud integral de las personas y promover procesos ciudadanos de resiliencia y recomposición del tejido social causada por la emergencia sanitaria mundial del coronavirus."
"373","Guayusa Científica","En este espacio los participantes exponen sus artículos científicos, aportando de esta manera a la construcción de conocimiento en conjunto, resolviendo dudas y posiciones como resultado de esta interacción.","Es un programa donde se proponen un conjunto de actividades que permite a investigadores interactuar con la comunidad, a través de espacios destinados para seminarios y divulgación de contenido científico con énfasis en plantas."
"245","Hablemos en Positivo","Comunicación y sensibilización enfocada en visibilizar y promover los derechos humanos de las personas LGBTIQ+ en situación de movilidad humana por medio de compartir historias de vida, desmitificar el COVID-19 y VIH. Así también con la entrega de kits de salud sexual y reproductiva.","Fomentar la salud y la prevención de enfermedades de transmisión sexual (VIH y otras ETS) y de la COVID-19 mediante la sensibilización, visibilización y promoción de los derechos humanos de las personas LGBTIQ+ en situación de movilidad humana."
"239","Hackathon 2021","Los emprendedores recibirán un speed mentoring a cargo de expertos en el área de su idea de negocio, además asesoría para el escalamiento de su idea de negocio. Los12 mejores proyectos pasarán a las fases de incubación y aceleración y recibirán un capital semilla en especie para continuar con el desarrollo y mejoramiento de su prototipo.","Es un evento de innovación donde se presentarán 28 productos y/o servicios tecnológicos, digitales, ambientales, robótica, moda, y gastronomía, entre otros, desarrollados por 60 jóvenes tungurahuenses, quienes han pasado por un programa integral de emprendimiento. Este evento reúne a jóvenes emprendedores, empresarios, académicos y expertos, lo que aporta al fortalecimiento del ecosistema emprendedor de la provincia de Tungurahua."
"131","Handeyes","Mediante un dispositivo electrónico, ayuda a las personas con discapacidad visual para alertar mediante vibraciones y sonidos, obstaculos enfrente de ellos.","Es un dispositivo electrónico para personas con discapacidad visual que a través de vibraciones y sonidos alerta al usuario de obstáculos que se encuentran frente a él y así pueda evitar golpes."
"162","Hosh","Uso de materiales ambientalmente amigables para cambiar paradigmas de vestimenta y consumo responsables.","""hosh"" (""nieve"" en kawesqar) es una marca de ecodiseño de vestuario, productos y accesorios en constante movimiento en pro de la ecología. trabajamos con materia prima reciclada, fibras de origen animal y vegetal con la intención de que nuestros productos causen el menor impacto posible desde su fabricación hasta la puesta en el anaquel."
"142","Huella de carbono","Mediante la medición de la huella de carbono busca fortalecer la competitividad, otros beneficios son optimización de procesos e inducción de innovación.","CORPEI, con el apoyo del Ministerio del Ambiente, tiene el agrado de invitarlo a participar en la IV Edición del Proyecto de “Medición de Huella de Carbono de Productos”, el cual busca fortalecer la competitividad de las empresas a través de la implementación de la medición de la Huella de Carbono."
"168","Humana Pueblo a Pueblo","Uso del conocimiento y la interacción social para crear estrategias para salir de la pobreza.","Humana Pueblo a Pueblo – Ecuador es una fundación sin fines de lucro que comenzó a trabajar en Ecuador en junio de 2007. Nace mediante Acuerdo con el Ministerio de Inclusión Económica y Social (MIES) en mayo de 2008, está registrada en el Sistema Unificado de Información de Organizaciones Sociales (SUIOS) y cuenta con acreditación para recibir fondos públicos."
"93","I3LAB Education","Realización de cursos formales, talleres, eventos, concursos y coaching fundamentados en la formación experiencial, multidisciplinaria y vinculada al entorno.","Desarrollamos las competencias y la cultura emprendedora dentro y fuera de la universidad a través de cursos formales, talleres, eventos, concursos y coaching fundamentados en la formación experiencial, multidisciplinaria y vinculada al entorno."
"95","I3LAB Outreach","Design Thinking, Análisis de Tendencias, Prototipo Rápido y otras metodologías y herramientas  que permiten potenciar una organización y generar impacto.","Ayudamos a integrar y desarrollar organizaciones innovadoras y a concebir productos y servicios de mayor valor que le permitan satisfacer las necesidades de sus clientes y usuarios."
"94","I3LAB Startups","Se busca transformar el entorno promoviendo la interacción, creando innovación y logrando impacto.”","Proveemos incubación de startups, mentoría y contactos con entidades y expertos de ESPOL, de Guayaquil y del Mundo para ayudar a potenciar emprendimientos dinámicos e innovadores.   Facilitamos infraestructura a través de nuestro coworking, laboratorios y el fablab Asiri."
"96","I3LAB T-Transfer","Alianzas estratégicas y outsourcing de I + D, investigación y desarrollo patrocinados, proyectos puntuales estudios y desafíos.","Conectamos la investigación con el mercado para lograr el bienestar social y el desarrollo del país y la región. La ciencia y la tecnología ofrecen oportunidades de generar nuevas soluciones a los problemas de la sociedad y permiten a las empresas generar valor exportable."
"90","IMPACT DAY","Promoción de energías sostenibles.","Nuestra iniciativa implica en un dia de trabajo comunitario en alguna comunidad vulnerable donde apoyamos para colocar luminarias activadas con energía solar. Asi mismo hemos apoyado a escuelas y colegios de Fe y Alegría para hacer mingas de limpieza, reparación y pintura de los establecimientos."
"116","IMPACT DAY","Promoción de energías sostenibles.","Nuestra iniciativa implica en un dia de trabajo comunitario en alguna comunidad vulnerable donde apoyamos para colocar luminarias activadas con energía solar. Asi mismo hemos apoyado a escuelas y colegios de Fe y Alegría para hacer mingas de limpieza, reparación y pintura de los establecimientos."
"74","INSTITUTO DE DESARROLLO PROFESIONAL – IDEPRO","Por medio de capacitaciones y actividades de educación continua, ayudan a mejorar el sector empresarial del país","Brindar servicios de capacitación al sector empresarial del país, promoviendo y generando actividades de formación continua, competencias laborales y asesorías, mediante el aprendizaje y la utilización de las herramientas tecnológicas, pedagógicas y de gestión más actualizadas, aportando valor a los socios de la Cámara de Comercio de Guayaquil y al público en general."
"115","INÉDITA","Diseño bioclimático","Enfoque sistémico del diseño bioclimático y la construcción de un arquetipo de vivienda de interés social para habitantes de Monte Sinahí con el uso de Ecomateriales producto de investigaciones realizadas en la Universidad Católica de Santiago de Guayaquil."
"163","Idukay","Uso de tecnologías en la comunicación y difusión educativa.","""Idukay es una plataforma que se despliega como SaaS (Software as a Service) en la nube, lo que permite que la aplicación esté disponible de manera prácticamente inmediata. En el aspecto técnico, el sistema está programado en JavaScript, de manera que la carga del sistema es sencilla y rápida.

Esta herramienta fue diseñada de acuerdo a los parámetros de sencillez de uso, estabilidad y cumplimiento de los lineamientos y estándares del Ministerio de Educación."""
"253","Ikiama Nukuri","Ikiama Nukuri ha estado trabajando en colaboración con la Nacionalidad Achuar del Ecuador para desarrollar un modelo de atención de  salud en una manera que sea culturalmente apropiada, empoderadora y sostenible.","La misión de Ikiama Nukuri es fortalecer y amplificar las voces colectivas de mujeres indígenas para mejorar la salud materna, infantil y reproductiva de las nacionalidades indígenas en la Amazonía Ecuatoriana. Ikiama Nukuri entrena a promotoras de salud"
"151","Image Tech","Mediante asesorias digitales, desarrollo iterativo de e-commerce, websites, cloud computing , e- banking llevan a las empresas a una trasformación digital para aumentar sus ingresos","En Image Tech apostamos a facilitar la sinergia entre tu negocio, el mercado y tus potenciales clientes a una trasformación digital para aumentar sus ingresos"
"80","Impaqto","""Una escuela de innovación de triple impacto
social, ambiental y económico."" , MPAQTO es una empresa B dedicada a apoyar a los agentes de cambio","IMPAQTO es una empresa B dedicada a apoyar a los agentes de cambio: emprendedores, freelancers, PYMES, corporativos e intraemprendedores para construir un ecosistema en el que todos crezcamos de una manera sostenible para el planeta y nuestras comunidades."
"108","Impulso Cultura","Apoyo al sector artístico","Solución financiera que fomenta y desarrolla las actividades creativas para incentivar el ejercicio de los derechos culturales de artistas y gestores vinculados a la cadena productiva del sector."
"82","Impulso Joven","Busca fortalecer el desarrollo y sostenibilidad de los emprendimientos Ecuatorianos.","Impulso Joven, es el nombre de la política pública nacional de juventudes de nuestro país, coordinado por la secretaría técnica de juventudes del Ecuador ."
"197","Iniciativa Caja de herramientas","Facilita la gestión local desde la cualificación de su gestión en distintas áreas. Proporciona elementos para la comprensión, la investigación y el debate sobre la pertinencia de las políticas y normativas públicas locales. Genera mecanismos e incentivos para gobiernos locales, mediante procesos formativos y de intercambio de experiencias.","Es una sistematización de experiencias de gestión, legales, normativas, instrumentales, metodológicas que pueden ser compartidas, intercambiadas y retroalimentadas para uso, aplicación y fortalecimiento de los gobiernos locales."
"98","Innobis","Busca estimular el contacto y formación de redes con actores afines por medio del uso del espacio como medio de sinergia de las iniciativas que funcionan.","INNOBIS  es un Centro de Emprendimiento e Innovación apoyado, inicialmente, por el Consorcio Nobis y KrugerLabs. Será mucho más que un espacio físico, será una empresa que a través de varias herramientas acelere la evolución de proyectos innovadores, con alto potencial de crecimiento e internacionalización."
"67","Insight Bites","Por medio de charlas online (instagram live) ayudan a los emprendedores a conocer sobre Marketing Digital, emprendimiento, branding, relaciones públicas para que pongan en marcha sus ideas de negocio","Insight Bites es un espacio que hemos creado junto a nuestro fundador Guillermo Vizcaino para compartirles conocimiento y resolver dudas sobre Marketing Digital, Emprendmiento, Branding, Relaciones Públicas y mucho más desde nuestro Instagram Live de lunes a viernes de 21h00 a 21h30"
"112","Invernadero","Salas multifuncionales para generar lazos a partir de la teoría del espacio.","Incubadora de negocios, enfocada en pequeños negocios que requieren apoyo constante, salas multifuncionales para generar lazos a partir de la teoría del espacio que nosotros conocemos."
"20","Inversión Ángel","Creación de emprendimientos sostenibles, con alianzas estratégicas por medio del nexo entre innovadores con inversionistas ángeles que dan un financiamiento en etapas tempranas siendo un capital inteligente porque viene acompañado de un socio estratégico","Empresa de consultoría que promueve el emprendimiento en el Ecuador a través de asesorías, capacitaciones, organización de eventos y publicaciones entre los inversionistas para la creación de emprendimientos."
"54","Investigación","A traves de charlas y coloquios e investigación se diseña política pública adaptada al contexto local. El laboratorio interconecta problemas, identifica áreas críticas y diseña políticas basadas en evidencia.","La propuesta de investigación de CTS LAB se basa en la metodología de investigación-acción para co-diseñar política pública adaptada al contexto local con implementación experimental"
"127","Jardineras Biofiltrantes","Mediante tecnología vermifiltro implantada en una jardinera se realiza el tratamiento de aguas negras para lugares sin alcantarillado obteniendo hummus y agua de riego","Estas jardineras se realizan con un vermifiltro. El vermifiltro es uno de los mejores inventos de las últimas dos décadas en relación al tratamiento descentralizado de aguas negras. Es un sistema aeróbico, la descomposición de la materia orgánica está realizada principalmente por lombrices (eisenia foetida), bacterias y otros microorganismos aeróbicos cuyo principal subproducto es humus. El mantenimiento de estos sistemas es simple y solo requiere un cambio de sustrato una vez al año."
"170","Jovenes Ejemplares","Uso de TIC's para coordinar acciones multidisciplinarias entres diversos actores.","Es un proyecto de  la M. I. Municipalidad de Guayaquil con el apoyo de Fundación Ecuador, que motiva el espíritu de superación de los jóvenes estudiantes de bachillerato de los colegios fiscales y fiscomisionales, e incentiva a los padres de familia a darles su apoyo incondicional a para que sean excelentes estudiantes y culminen con éxito el bachillerato."
"32","Junt@s","Por medio de una aplicación permite combatir con la violencia de género, puesto que puede hacer una llamada de auxilio. Ayuda a detectar los primeros signos de violencia de género","La aplicación Junt@s es una herramienta informática dirigida principalmente a mujeres que sufren de violencia de género, también está destinada a cualquier persona que detecte en su entorno una posible situación de violencia de género y a toda persona interesada en general."
"106","Juntos","Administración en grupos.","JUNTOS financia proyectos de emprendimiento dirigidos por un grupo desde 2 personas hasta 5 personas naturales, de nacionalidad ecuatoriana, en relación de dependencia y/o que realicen actividades empresariales o en libre ejercicio profesional, asociadas bajo la figura de un Consorcio Mercantil."
"58","Jóvenes IN","Por medio de la plataforma web, permite transformar la visión de los jóvenes al capacitar en habilidades para la vida, también prepara para el empleo al dar capacitaciones en habilidades para el empleo finalmente capacíta en áreas técnicas para especialización de acuerdo al perfil del jóven","El futuro de los jóvenes lo tenemos que construir hoy, te preparamos por la ruta al empleo con capacitaciones presenciales, online y formación técnica, así engrandeces tu conocimiento para empezar tu vida laboral y ser parte de los jóvenes que cambiarán su visión."
"358","Kapawi","La propuesta de turismo comunitario y sostenible con el medioambiente se ha convertido en un emblema y un ejemplo a nivel regional; además Kapawi contribuye al desarrollo socio-económico de la nacionalidad Achuar.","Kapawi Ecolodge & Reserve es uno de los destinos turísticos preferidos en la amazonía ecuatoriana desde 1996. Gracias a la experiencia de conocer en profundidad la cultura Achuar, por sus prácticas respetuosas con el medio ambiente, excelencia en la calidad y cumplimiento de las normas internacionales de turismo sostenible"
"208","Kbus","La iniciativa permite a los usuarios movilizarse de manera eficiente en el transporte público.","Es un sistema de apoyo al transporte público para la gestión de la recaudación, monitoreo y control de flotas de buses dentro de las ciudades."
"284","Kikuyo","Kikuyo tiene como objetivo reducir la generación de basura innecesaria a través del uso de productos reutilizables.","Kikuyo Ecuador es una empresa 100% ecuatoriana, enfocada en la producción y comercialización de productos para el hogar; sostenibles, naturales, amigables con el medio ambiente y sobre todo, prácticos, que nos permiten reemplazar el plástico y los desechables que utilizamos a diario."
"132","LA NARANJA CIENTÍFICA","Con esta actividad deseamos fortalecer la memoria, el razonamiento lógico, la colaboración; incentivar la motivación para encontrar su pasión y promover el desarrollo de herramientas para investigar en niños, niñas y jóvenes.","""“La Naranja Científica” llevará talleres, charlas y juegos para despertar la curiosidad y el pensamiento crítico de niños, niñas, jóvenes y sus familias.
 Demostramos que la ciencia es divertida: creando, experimentando y explorando nuestro universo a través de actividades lúdicas."""
"27","LABIN","Educa a niños y jovenes sobre como diseñar e innovar soluciones para problemas globales, mediante herramientas modernas de diseño y fabricación digial, así como herramientas de educación inmersiva y robótica","Espacio para la aplicación de MODERNAS METODOLOGÍAS DE PENSAMIENTO DE DISEÑO, donde niños y jóvenes bajo el programa “PIENSAIN” diseñan e innovación soluciones para resolver un problema global"
"338","La Casa del Árbol","Hay dos etapas: la primera que consiste en la formación de promotores infantiles, para que sean los mismos niños quienes establezcan campañas de sensibilización en sus escuelas; en la segunda etapa, hay la participación de los maestros, introduciendo la metodología “La Casa del Árbol”, con actividades que fortalecen el aprendizaje de los alumnos.","El proyecto ""Casa del Árbol"" del Gobierno Autónomo Descentralizado Municipal de Riobamba tiene como objetivo precautelar la salud de los niños, niñas y jóvenes a través de capacitaciones en educación nutricional y salud preventiva; en aras de prevenir el consumo de drogas. El proyecto ha trabajado con 31 instituciones educativas, 32 barrios y comunidades de los sectores urbanos y rurales."
"312","La Naranja Científica","Demostrar que la ciencia es divertida: creando, experimentando y explorando el universo a través de actividades lúdicas","Con esta actividad desean fortalecer la memoria, el razonamiento lógico, la colaboración; incentivar la motivación para encontrar la pasión y promover el desarrollo de herramientas para investigar en niños, niñas y jóvenes.
Este proyecto ha sido ejecutado durante tres años en el Museo Interactivo de Ciencia, como talleres vacacionales, fortaleciendo la experiencia de sus talleristas y del contenido que comparten."
