"id","nombre_iniciativa","componente_innovador","descripcion_iniciativa"
"153","""IA-Powered Robotic  Process Automation""","Mediante automatizaciónes de procesos con RPA como los Chatbots que sirven como servicio al cliente en horas no laborables, genera aumentos en productividad y rentabilidad","La automatización robótica de procesos (RPA) ayuda a delegar tareas mundanas en algoritmos. Combinamos soluciones RPA con nuestra fuerza ya establecida en la implementación de IA para ofrecer soluciones inteligentes de automatización de procesos. Aprovechamos el aprendizaje automático, la comprensión del lenguaje natural y la visión por computadora para garantizar que sus procesos no solo sean automatizados, sino autónomos e inteligentes."
"13","ACADEMY FOR WOMEN ENTREPRENEURS AWE – DREAMBUILDER ECUADOR","Empoderamiento a mujeres a través de capacitación empresarial mediante herramientas digitales con modalidad E-learning y presencial.","La Academia, equipará a las mujeres con las destrezas prácticas necesarias para crear empresas y negocios sostenibles. Mediante una comunidad de aprendizaje inclusiva, mujeres de todo el mundo tendrán oportunidades para explorar los fundamentos de los negocios, tales como la preparación de planes empresariales y obtención de capital, con la meta de construir un mejor futuro para las familias y comunidades de todo el mundo"
"15","AEI-innova","Por medio de conferencias se motiva a las empresas a generar cultura de innovación, con talleres de formación capacitan a empresas para implementar innovación, además cuentan con desafíos de innovación para que la organización los resuelva e innove.","El rol de AEI es generar continuidad en procesos y proyectos mediante la articulación de esfuerzos entre sus aliados, de tal manera que se generen sinergias para apoyar a que los emprendedores e innovadores tengan acceso a: Información de emprendimiento e innovación que permita a los emprendedores tomar decisiones acertadas y que mitiguen el riesgo, en lo relacionado a sus empresas. Financiamiento de capital de riesgo que les permita a los emprendedores poner en marcha proyectos innovadores. Acceso a educación emprendedora para niños en escuelas y colegios; y desarrollo de competencias emprendedoras para profesionales"
"216","AGRO-WORKS","Las herramientas y servicios son de manera personalizada y se otorgan mediante un logaritmo de inteligencia artificial que detecta el tipo de perfil de usuario para darle acceso a las distintas funcionalidades de la aplicación según sus necesidades, y según su geolocalización a través del mapeo geográfico de su ubicación en tiempo real.","AGRO-WORKS es un Marketplace Inteligente Agrícola de proximidad, siendo una plataforma y aplicación multidispositivo de comercio electrónico agrícola que brinda canales de compra y venta de productos y/o servicios agrícolas entre productores, proveedores, minoristas, mayoristas y consumidores. Además provee de herramientas de gestión de riesgo, información climática, agro contactos y capacitación técnica, que proveen en tiempo real acceso a información relevante del sector agrario permitiendo gestionar de manera inteligente la relación de la cadena de valor agrícola para vender, comprar, comunicarse entre los productores, proveedores de insumos y consumidores, y toma de decisiones."
"146","AGROIQ","Mediante un software especializado para empresas agrícolas, incrementa sus ingresos y disminuye costos debido a la la obtención de información a tiempo real para toma de decisiones","""AGRO IQ es un potente software agrícola. Conecta software y/o hardware existente en un solo panel de control para administrar la información de manera más eficiente.
 Permite correlacionar múltiples variables y tomar decisiones en tiempo real. Facilita la disminución de costos, aumenta la productividad y mejora la calidad de los productos y servicios."""
"179","AME Virtual Capacitación","Plataforma digital (con aplicación celular) para capacitación y gestión de conocimiento en la gestión urbana. Da soporte y acompañamiento técnivo, metodológico sobre temas de competencia municipal, gestión institucional y gobernabilidad para los funcionarios de GAD","“AME Virtual” tiene como finalidad fortalecer las capacidades de liderazgo y la gestión de los Gobiernos Autónomos Descentralizados (GAD) Municipales, además busca generar conocimiento y desarrollo de competencias sobre la base de las políticas nacionales y locales. De esta forma apoya al mejoramiento del desempeño de los gobiernos municipales."
"236","ANA - Plataforma de Educación Virtual","Posibilita virtualizar los programas de capacitación a través de la transmisión en tiempo real o streaming, permitiendo a los usuarios beneficiarse de toda la gama de cursos disponibles desde cualquier lugar.","Es una aplicación desarrollada con el objetivo de romper barreras como la ubicación geográfica o la falta acceso a centros de capacitación profesional para contribuir al desarrollo profesional en Ecuador."
"277","ANUNA","Anuna es una iniciativa que busca escalar la recolección de desechos de la manera más efectiva. Ofrecen un servicio gratuito para ayudar a hogares a reciclar para recuperar los desechos orgánicos.","Anuna tiene un enfoque principal hacia la recolección y procesamiento de desechos orgánicos. Con esto aportan a la reducción de las emisiones de metano y mejora los índices de reciclaje."
"41","APCI","Por medio de una plataforma educativa, refuerza el conocimiento de los jóvenes sobre áreas de matemáticas y lenguaje","Es una plataforma educativa que permite reforzar el área de matemáticas y lenguaje, a los estudiantes de 1ero de básica hasta 3ro de bachillerato a su propio ritmo."
"218","AYUDAPP","Está configurada como una aplicación para dispositivos móviles que contribuye a la configuración de redes de actores capaces de maximizar la colaboración a una escala totalmente nueva gracias a la tecnología digital.","AyudApp es un proyecto destinado a cambiar la forma en que los diferentes actores involucrados en el cambio social interactúan entre sí a través de la tecnología digital. Se busca que funcione como una plataforma de conexión para grupos sin fines de lucro/organizaciones filantrópicas y personas dispuestas a apoyar su causa a través del voluntariado o de donaciones específicas necesarias para las ONG."
"362","Aceleración","Inversión temprana para startups tecnológicas y mujeres en emprendimiento. Adicionalmente, facilitan acceso a redes internacionales para emprendedores locales mediante su capacidad de colaborar y crear fuertes conexiones internacionales.","Entendemos que cada startup tiene necesidades específicas dependiendo de las fortalezas de su equipo, estado de madurez, industria o modelo de negocio. Por esta razón tenemos un programa hecho a la medida solo para ti. Trabajamos con las mejores startups que aplican a nuestro programa de mentorías. Estas son aquellas que están solucionando un problema relevante, tienen una solución escalable y una propuesta de valor diferenciada."
"14","Aceleración","Inversión temprana para startups tecnológicas y mujeres en emprendimiento. Adicionalmente, facilitan acceso a redes internacionales para emprendedores locales mediante su capacidad de colaborar y crear fuertes conexiones internacionales.","Entendemos que cada startup tiene necesidades específicas dependiendo de las fortalezas de su equipo, estado de madurez, industria o modelo de negocio. Por esta razón tenemos un programa hecho a la medida solo para ti. Trabajamos con las mejores startups que aplican a nuestro programa de mentorías. Estas son aquellas que están solucionando un problema relevante, tienen una solución escalable y una propuesta de valor diferenciada."
"8","Aceleración de Startups","Acceso a la nube de servicios para los starups, los cuales podrán utilizar los servicios (API's) según las necesidades y modelo de negocio","Incubadora que tiene como objetivo fomentar el Ecosistema Emprendedor en el Ecuador y ayudar a las StartUps con sus proyectos, los cuales ya se encuentren en estado de prototipo. Dan los servicios de mentoring, capital semilla, know-how, exposición ante inversionistas, talleres, networking, espacio físico en Kruger."
"66","Aceleradora de Negocios para Mujeres Empresarias","Por medio de Charlas, menorías y alianzas estratégicas ayudan a mujeres empresarias y emprendedoras a potenciar e innovar sus ideas de negocio","A través de la primera aceleradora de negocios de mujeres empresarias del Ecuador apostamos al empoderamiento de la mujer empresaria, implementando estrategias de crecimiento e innovación para su negocio junto a programas de mentoring y red de contactos estratégicos."
"234","AesoftMarket","La herramienta “AesoftMarket” es un aporte para que los distintos clientes en el mercado ecuatoriano e internacional puedan conocer la oferta de soluciones tecnológicas que hay en el Ecuador. Se encuentra agrupada por industria y por nivel de conocimiento de la empresa proveedora con respecto a la misma.","AesoftMarket es una plataforma que permite presentar la capacidad tecnológica de las empresas de software del Ecuador para los sectores productivos del país, llenando un vacío de información existente entre los sectores productivos y la capacidad de las empresas de tecnologías de la información.
Con esta herramienta se espera que la búsqueda sea fácil, amigable y productiva para que los clientes puedan ubicar fácilmente los proveedores acorde a sus necesidades."
"21","Agricultura Urbana Participativa - AGRUPAR","Mediante una red de actores, capacita a las personas sobre la agricultura orgánica, crianza de especies menores para después dar la oportunidad de comercializar en ""bioferias"", los excedentes de sus producciones","A través de la implementación de huertos con producción orgánica, crianza de animales menores, procesamiento de alimentos y comercialización de excedentes por medio de Bioferias, dentro del esquema de apoyo a la producción sana y solidaria. La agricultura urbana es una actividad integradora que incrementa la biodiversidad urbana y mejora la gestión ambiental, mejora los ingresos, además genera empleo y ahorro por el consumo de la producción propia para sus participantes"
"297","Agro Height","El beneficio directo es ir midiendo periódicamente el crecimiento del cultivo y tomar decisiones a tiempo en el transcurso del ciclo de producción para realizar ajustes de manera objetiva.
De esta forma se puede optimizar el cultivo y se puede obtener la máxima producción posible mejorando puntualmente las condiciones que se requieran.","Es una herramienta de monitoreo enfocada en obtener la altura del cultivo en toda su etapa de crecimiento, con el fin de cuidar y asegurar los niveles de producción adecuados."
"346","Agro Perception","sistema autónomo móvil de detección de plagas, enfermedades y problemas en cultivos de invernadero, basado en una plataforma robótica móvil provista de una cámara espectral y sensores.","optimizar y mejorar la actual metodología de inspección de cultivos de rosas en el Ecuador. Mejorando la producción y disminuyendo el riesgo de exportar rosas contaminadas con enfermedades o plagas. Para lograr esto se presenta un sistema autónomo que trabaja 24 7 en la detección de plagas, enfermedades y problemas, basado en la última tecnología en procesamiento de imágenes. El monitoreo y mapeo de la plantación estará disponible al usuario por medio de un software"
"295","AgroCloud","Permite que se efectúe un procesamiento rápido en la web del levantamiento fotogramétrico por drone.
Brinda la posibilidad de una visualización accesible desde la web del estado del cultivo mediante los ortomosaicos y su información multiespectral.
Además, hace factible la interacción con el ortomosaico.","Agrocloud es una plataforma web destinada al procesamiento de fotografías capturadas por drone, ya sean multiespectrales o RGB; con la finalidad de obtener los ortomosaicos de la zona."
"296","AgroMetri","Permite obtener un diagnóstico temprano de la eficiencia del área sembrada en la etapa inicial de crecimiento del cultivo y tomar decisiones, ya sea de sembrado u otro tipo de actividad agrícola, para asegurar que el cultivo no sufra una disminución de producción al momento de la cosecha.","Es una herramienta de prevención enfocada en obtener el porcentaje de densidad por números plantas (despoblación) de un cultivo para mantener la eficiencia de este."
"237","Agroecología en América Latina: construyendo caminos","Recolección de datos realizada de forma participativa con familias agricultoras y organizaciones de apoyo, facilitado por una herramienta digital de gestión agrícola desarrollada por un equipo de científicos, agricultores-colaboradores, diseñadores, desarrolladores y estudiantes de UBC, llamada LiteFarm.","Iniciativa piloto regional que tiene como estrategia recoger y sistematizar evidencias científicas para el desarrollo de Indicadores de la Agroecología, con el objetivo de contribuir con la transición agroecológica y subsidiar la construcción de políticas públicas que promuevan el avance de la Agroecología."
"321","Alianza para el desarrollo Urbano Sostenible - ADUS","Impulsamos iniciativas orientadas al desarrollo sostenible de comunidades a partir de alianzas público-privadas para: 1. Incidir en el mejoramiento de las relaciones comunitarias. 2. Promover una gestión sostenible y participativa de lo local. 3. Fortalecer capacidades de asociaciones productivas.","ADUS se constituyó como un espacio de trabajo colaborativo y sinérgico para promover el compromiso de la ciudadanía y  de los y las candidatas a las alcaldías y sus equipos de trabajo para incluir el Cambio Climático y el Desarrollo Urbano Sostenible en acciones y en sus planes de gobierno, en el plazo inmediato."
"101","Amautha Hub","Aprendizaje en comunidad para formar relaciones estratégicas de emprendimiento que provee espacios de trabajo colaborativo.","Somos una plataforma de emprendimiento que provee espacios de trabajo colaborativo en comunidad, y  desarrolla recursos para negocios en comunidad para formar relaciones estratégicas de emprendimiento."
"100","Amautha Hub","Aprendizaje en comunidad para formar relaciones estratégicas de emprendimiento que provee espacios de trabajo colaborativo.","Somos una plataforma de emprendimiento que provee espacios de trabajo colaborativo en comunidad, y  desarrolla recursos para negocios en comunidad para formar relaciones estratégicas de emprendimiento."
"308","Aprendiendo a Pescar","El proyecto “Aprendiendo a Pescar” apunta a desarrollar emprendimientos sostenibles y sustentables a través de la capacitación a la población, encaminados a mejorar la calidad de vida de los ciudadanos/as y reducir la brecha de la desigualdad social.","El proyecto denominado “Aprendiendo a Pescar” tiene como objetivo propiciar el desarrollo de pequeños emprendimientos productivos y de servicios en las parroquias y comunidades del cantón Guaranda, mediante talleres de Capacitación Artesanal.
Este proyecto está dirigido para personas en condiciones de vulnerabilidad, mediante la capacitación en ramas artesanales tales como panadería, belleza y peluquería, corte y confección, carpintería, repostería, adornos para el hogar, etc. La capacitación incluye la entrega de kit personales de trabajo y un certificado de capacitación con el aval de la Junta Nacional del Artesano."
"347","Aprendizaje Libre - coddic","programa educativo integral que enseña las bases de Ciencias de la Computación a niños y niñas a partir d los 8 años de edad, utilizando un entorno virtual de enseñanza aprendizaje.","Generar la enseñanza de ciencias de la computación a niños y niñas a partir de tres niveles: Jugando con Binarios, Construyendo Algoritmos, Dominando Código.  Así mismo construir una asignatura de esta temática para aplicarse en Ecuador u otros países de Latinoamérica que apuesten por la codigo-alfabetización para desarrollar el pensamiento computacional a edades tempranas."
"120","Arsquitensis: transmedia patrimonial.","Por medio de narrativas transmedias narrar los espacios de arte patrimonial para generar apropiación del patrimonio en la gente","""Los objetivos del proyecto son:
 
 Narrar los espacios de arte patrimonial con herramientas digitales.
 Crear espacios de inmersión e interactividad con las audiencias.
 Contar historias de la gente y su relación con el patrimonio.
 Generar apropiación del patrimonio en la gente.
 Brindar apoyo a los espacios culturales y patrimoniales en el desarrollo de narrativas transmedia."""
"119","Arte Contemporaneo Ecuador","Plataforma web que reúne la información de artistas de diversas generaciones para difundir su producción artística","Plataforma web lanzada en 2015 que busca difundir la producción de artistas contemporáneos de Ecuador. Hasta el momento la plataforma reúne el trabajo de más de 150 artistas visuales de diversas generaciones y trayectorias."
"310","Arte, migración y reciclaje en Ibarra","Uso de la App ReciApp para optimizar el registro y contacto con recicladores de la ciudad así como población migrante. Articulación del arte y el uso de fuentes de energía alternativa para brindar mejores condiciones a los recicladores.","A través de actividades lúdicas y de bienestar reúnen recicladores de la ciudad de Ibarra así como personas migrantes, para registrarlos en la App ReciApp, que cumple el propósito que los ciudadanos los busquen en el mapa, los contacten y entreguen directamente el material reciclable en estado adecuado. Así, los ayudan a mejorar sus condiciones laborales y su calidad de vida."
"313","Artesalinas","Fortalecimiento del proceso productivo y de la comercialización de artesanías elaboradas con lana de oveja y llama","Desde 1974 quince mujeres organizadas por la salinera Gladys Salazar y con el apoyo de algunas personas más, se organizaron para diseñar productos artesanales de lana de oveja y llama. Con el tiempo se introdujeron mejoras en el proceso productivo y de comercialización, que les ha permitido llegar a mercados como Italia, Alemania y Finlandia."
"195","Asamblea General RICHSL","Se manejan cuatro líneas de investigación referentes a educación y ciencia, software libre para una sociedad libre, hardware libre y tecnologías de software libre. Las líneas de investigación se enmarcan en la investigación colaborativa, participativa y abierta.","Es un espacio de encuentro, debate y articulación para la gestión democrática de la red. Desde él se definen los requerimientos de investigación en el sector de hardware y software libre; se produce conocimiento a través de grupos de estudio que se articulan con la academia y la sociedad civil; y se impulsa el debate de las problemáticas relacionadas con la investigación, el conocimiento, y las tecnologías libres para generar acciones a implementar."
"111","AsertivaLab","Creación de espacios de desarrollo de creatividad.","AsertivaLab te ofrece espacios de trabajo colaborativos para el desarrollo y ejecución de tus ideas junto a otros profesionales, en un ambiente confortable e inspirador."
"138","Asesoría a Emprendedores","Mediante la metodología CISU “Creando Innovadores Start-Ups” genera soluciones, ideas disruptivas que generan un valor económico y/o social a los emprendimientos","La metodología CISU “Creando Innovadores Start-Ups”, ha sido creada para la generación de emprendimientos disruptivos, con base en ideas radicales potenciando la creatividad, en diferentes áreas o industrias"
"248","Asesoría y capacitación para promover la gestión eficiente y efectiva de instituciones públicas y privadas","Asesoramiento y planes de emprendimiento empresarial; asesoría y capacitación en diseño, elaboración y gestión de proyectos; desarrollo de Estructuras y Modelos de Gestión Institucional, y aplicación de metodologías presupuestación.","Se orienta a promover la gestión eficiente y efectiva de instituciones públicas y privadas para el cumplimiento de sus objetivos y metas. Cuenta con un equipo multidisciplinario para proponer soluciones a los más complejos retos las empresa y organizaciones. Además, despliegan metodologías de investigación para solventar necesidades con enfoque global y sostenibilidad."
"102","Asociación de jóvenes Empresarios del Ecuador","Networking Empresarial, Eventos Especiales, Representación Gremial a bajo costo para potenciar los negocios.","La Asociación de Jóvenes Empresarios, AJE Ecuador, promueve la oportunidad de potenciar negocios entre empresarios jóvenes del país, poniendo a su disposición una red de contactos públicos y privados a niveles nacional e internacional"
"263","Atención a población colombiana migrante y refugiada en el Ecuador","Debido a la ausencia de socialización y difusión de derechos y servicios a la población colombiana en el Ecuador, uno de los elementos del proyecto se ha orientado al fortalecimiento la capacitad institucional, a través de estrategias de formación en temas de sensibilización de género en movilidad humana.","El proyecto busca incrementar el acceso a mecanismos de protección a la población migrante y refugiada colombiana, integrarlos a los servicios y programas de desarrollo gubernamentales, así como facilitar su inclusión social e integración en las comunidades de acogida."
"221","B-Women","B-Women cuenta con un Club de Mujeres Innovadoras, para crear una comunidad representada por los emprendimientos más destacados e innovadores; y una Aceleradora de Mujeres Innovadoras, la primera de este tipo para las mujeres empresarias del país, programa destinado a impulsar a empresas con potencial.","En un escenario en el que las mujeres empresarias del Ecuador enfrentan desafíos personales y obstáculos del entorno empresarial en su desarrollo en diferentes ámbitos; se orienta a promover la mejora de sus capacidades empresariales y de liderazgo a través de la generación de redes de contactos, acceso a fuentes de financiamiento y visibilidad corporativa en el mercado."
"63","BSMART","Para fomentar la cultura de innovación y beneficiar e impulsar a las micro, pequeñas y medianas empresas, se genera un evento INNOVATALK, que reune CEO's gerentes, emprendedores para introducir y preparar retos de la implementación de la transformación digital e innovación en las empresas","Acortamos la brecha tecnológica de las Pymes, implementando estrategias y herramientas que potencien su transformación digital para incrementar su productividad y competitividad. de la transformación digital."
"64","BSTRATEGY (Ciudades competitivas)","Con Hogares In se facilita el acceso a tecnologías de la información a 50000 familias guayaquileñas a través del subsidio de 20 usd otorgado por la Alcaldía de Guayaquil con el que pueden canjear más un valor adicional una tablet con plataformas educativas: APCI, KHAN ACADEMY y DUOLINGO impactando positivamente el desarrollo académico desde casa.","Con nuestra solución B Strategy establecemos la estrategia, conceptualizamos y diseñamos ciudades innovadoras.B Strategy involucra a todos los actores de la sociedad logrando crear verdaderas ciudades innovadoras e inclusivas, donde se fomenta las capacidades de innovación a los niños, ciudadanía y empresas."
"83","Banco de Alimentos de Quito","Acción comunitaria por un bien común.  Los alimentos son redistribuidos a población vulnerable.","El Banco de Alimentos de Quito de la Escuela Politécnica Nacional se encarga de evitar el desperdicio de alimentos en la ciudad. Los alimentos son redistribuidos a población vulnerable."
"36","Banco de Ideas","Es un portal donde la gente puede intercambiar comentarios, compartir, o discutir nuevas ideas. Además puede revisar los agentes de innovación que hay de acuerdo con un mapa georeferencial","Banco de Ideas, un portal donde puedes invertir tus proyectos, investigaciones, prototipos para recibir apoyo y servicios especializados, y desarrollar el componente creativo, tecnológico e innovador de tus ideas. Queremos impulsar tus proyectos para transformarlos en bienes y servicios que resuelvan problemas y necesidades sociales, fomentando el desarrollo productivo y el buen vivir de la sociedad."
"279","Be Green","Be Green es una iniciativa que brinda asesoría ambiental y capacitaciones en torno a iniciativas por el clima por medio de canales digitales. Juntan varios tipos de servicios de carácter ambiental.","Be Green es una iniciativa que brinda asesoría ambiental y capacitaciones en torno a iniciativas por el clima. Adicionalmente brindar consultoría ambiental y guía en seguridad industrial."
"286","Betero","Betero promueve el consumo consciente. Verifican el origen sus materiales y usan papel de alta calidad, reciclable, biodegradable, sin cloro, sin ácido, ni metales pesados.","Betero, libretas para dibujo, apuntes, arte o creación; cosidas, hechas a mano, de varios tamaños y diseños, con papel especial y características que lo hacen atractivo en el mercado."
"122","BiciQuito","Mediante la prestación de bicicletas fomenta un modo de transporte no motorizado para viajes cortos.","BICIQUITO es una alternativa económica y ecológica para transportarnos en la ciudad: La Bicicleta Pública de Quito está disposición de los Quiteños y Quiteñas ."
